{
  "mode": "refresh_person_view",
  "person_ref": "person_yuxi",
  "profile_store_path": "D:\\Lenny_Bcontext\\skill-system\\relationship-ingestion\\incremental-scenarios\\2026-03-25-subsidy-engine-mo-input\\relationship-profile-store.incremental-2026-03-25-subsidy-engine-mo-input.json",
  "options": {
    "write_store": true,
    "write_markdown": true,
    "save_run_artifacts": false,
    "graph_max_nodes": 8,
    "graph_max_edges": 12,
    "graph_min_relation_score": 2
  }
}
